"","created_at","text"
"320",2020-05-07,"a yearold man from el salvador became the first person to die from coronavirus while in immigration and customs enforcement custody a senior immigration official says"
"321",2020-05-06,"tyson foods says its largest us pork plant will reopen thursday after a major coronavirus outbreak forced the company to shut down the facility two weeks ago"
"322",2020-05-06,"the th person infected by coronavirus in vatican city works for pope francis the holy see press office says"
"323",2020-05-06,"blood thinners may help patients with severe covid infections but the findings are not clearcut enough yet to make solid recommendations doctors say"
"324",2020-05-06,"at least health care workers around the world have been infected with coronavirus according to data from the international council of nurses"
"325",2020-05-06,"a new york survey shows many hospitalized coronavirus patients were not working outside the home or traveling at the time of infection gov cuomo says"
"326",2020-05-06,"white house coronavirus task force members are in the dark on the panel's future a source says"
"327",2020-05-06,"belgium will ease coronavirus rules next week allowing stores to reopen and letting people socialize with four others from outside their household follow live updates"
"328",2020-05-06,"the white house coronavirus task force will continue indefinitely but shift focus trump tweets"
"329",2020-05-05,"the cook county medical examiner's office in chicago illinois plans to review previous deaths for evidence of covid as far back as november follow live updates"
"330",2020-05-05,"airbnb is laying off about of its workforce ceo brian chesky told employees the business has been hit hard by covid 's effect on the travel industry"
"331",2020-05-05,"just in white house coronavirus task force to be wound down around memorial day"
"332",2020-05-05,"ousted vaccine director rick bright has filed a whistleblower complaint alleging he began warning about coronavirus in january but was ignored"
"333",2020-05-05,"an experimental coronavirus vaccine entering into human trials in the us could be available in many millions of doses by the end of the ceo of biontech says"
"334",2020-05-05,"nearly one in five wendy's restaurants in the us are out of beef an analyst estimates as coronavirus takes a toll on meat suppliers"
"335",2020-05-05,"pfizer and german biotechnology company biontech say they have started testing an experimental coronavirus vaccine on humans in the us"
"336",2020-05-05,"starbucks says it will have responsibly reopened about of its us stores by the end of the week follow live coronavirus updates"
"337",2020-05-05,"a top executive at united airlines is telling employees to consider leaving the company voluntarily as it grapples with the consequences of the coronavirus pandemic"
"338",2020-05-05,"intelligence shared among us allies indicates it is highly unlikely that the coronavirus outbreak was spread as a result of an accident in a laboratory but rather originated in a chinese market officials say"
"339",2020-05-04,"an influential coronavirus model is nearly doubling its projection to about us deaths a researcher blames relaxed social distancing"
"340",2020-05-04,"a trump administration model projects the daily us death toll from coronavirus will nearly double to by june the new york times reports"
"341",2020-05-04,"ge is cutting up to jobs in its jet engine business because of the devastation to the aerospace industry brought by the coronavirus pandemic"
"342",2020-05-04,"japan extends its state of emergency until may but the country must prepare for a life with coronavirus prime minister shinzo abe says follow live updates"
"343",2020-05-04,"president trump says to people in the us could die from coronavirus a marked increase from what he would said previously"
"344",2020-05-03,"there were coronavirusrelated deaths in new york state in the past day gov cuomo said down from the previous day"
"345",2020-05-03,"trump economic adviser larry kudlow on if the small business stimulus program should receive more money as coronavirus continues to stunt employers we waited a little bit too long i thought when the last tranche ran out let us not make the same mistake again cnnsotu"
"346",2020-05-03,"russia reports new coronavirus cases in another record singleday increase"
"347",2020-05-01,"the white house will not let dr anthony fauci testify next week before a house committee probing the us coronavirus response"
"348",2020-05-01,"the fda has authorized the drug remdesivir for emergency use in hospitalized patients with severe covid"
"349",2020-05-01,"us stocks open lower after president trump hints that there could be new tariffs imposed on china as a result of the covid outbreak"
"350",2020-05-01,"top infectious disease expert dr anthony fauci says that if everything falls into place right there could be a coronavirus vaccine by january"
"351",2020-04-30,"macy's has announced plans to reopen of its stores in states that have loosened social distancing restrictions during the coronavirus pandemic"
"352",2020-04-30,"the little league world series has been canceled because of public health concerns with coronavirus organizers say"
"353",2020-04-30,"the uk has passed its coronavirus peak prime minister boris johnson says"
"354",2020-04-30,"top trump administration officials have pushed intelligence agencies to link coronavirus to chinese labs the new york times reports"
"355",2020-04-30,"los angeles will now offer free coronavirus testing for all residents with or without symptoms mayor eric garcetti says"
"356",2020-04-29,"the trump administration is launching an operation to accelerate the development of a coronavirus vaccine"
"357",2020-04-29,"the fda plans to announce an emergencyuse authorization for the drug remdesivir to treat coronavirus according to the new york times"
"358",2020-04-29,"dr anthony fauci says remdesivir coronavirus trial results show that the mortality rate trended towards being better with patients who took the drug though the who says it is too early to comment"
"359",2020-04-29,"at least tsa employees have tested positive for coronavirus"
"360",2020-04-29,"pending home sales dropped in march due to the coronavirus pandemic new data from the national association of realtors shows"
"361",2020-04-29,"the navy will announce that it is launching a broader inquiry into the coronavirus outbreak aboard the uss theodore roosevelt effectively delaying the recommendation that captain brett crozier should be reinstated"
"362",2020-04-29,"there is positive data emerging from a study on possible covid treatment remdesivir the maker of the investigational drug says"
"363",2020-04-29,"just in the us economy contracted for first time in nearly six years between january and march as the coronavirus crisis put the world in a choke hold america's firstquarter gdp fell at a annualized rate the us bureau of economic analysis reports"
"364",2020-04-29,"former vice president joe biden will win the ohio democratic primary cnn projects the primary had been pushed back after a confusing saga amid the coronavirus outbreak cnnelection"
"365",2020-04-28,"in less than three months more americans have died from coronavirus than the number of us service members killed in the vietnam war according to a johns hopkins university tally follow live updates"
"366",2020-04-28,"dr anthony fauci warns americans could be in for a bad fall and a bad winter if the us isn't prepared for the return of the coronavirus follow live updates"
"367",2020-04-28,"the number of confirmed coronavirus cases in the us surpasses one million according to a tally by johns hopkins university follow live updates"
"368",2020-04-28,"the olympics could be canceled if the covid pandemic continues into next year the tokyo president says"
"369",2020-04-27,"at least sailors from the uss kidd the second us navy ship hit with an outbreak of coronavirus have tested positive for the virus about of the destroyer's crew have been tested"
"370",2020-04-27,"house speaker pelosi says that the idea of a guaranteed minimum income for americans is perhaps worth considering during the coronavirus pandemic follow live updates"
"371",2020-04-27,"boris johnson has warned against relaxing the united kingdom's coronavirus restrictions too soon in his first remarks since returning to work after contracting the disease"
"372",2020-04-26,"new york gov andrew cuomo says people have died across the state over the past hours from coronavirus there were coronavirusrelated deaths in the state on friday follow live updates"
"373",2020-04-26,"children in spain are allowed out of the house for the first time in six weeks as coronavirus deaths in the country continue to decline follow live updates"
"374",2020-04-26,"just in white house officials are discussing plans to replace hhs secretary alex azar after criticism over the early coronavirus response"
"375",2020-04-25,"at least people have died from covid according to johns hopkins university's tally of deaths across the world follow live updates"
"376",2020-04-25,"there is no evidence yet that people who have had coronavirus are immune from a second infection the world health organization warns follow live updates"
"377",2020-04-24,"the fda warns against the use of two drugs hydroxychloroquine and chloroquine that have been touted by president trump as potential treatments for coronavirus"
"378",2020-04-24,"a second us navy ship the uss kidd has been hit by an outbreak of coronavirus with at least cases on the destroyer a navy official says"
"379",2020-04-24,"at least two florida counties announce plans to reopen their beaches during the covid pandemic"
"380",2020-04-24,"at least people have died in the us from coronavirus"
"381",2020-04-24,"there is no evidence suggesting coronavirus can be transmitted by food the fda commissioner says follow live updates"
"382",2020-04-23,"breaking the house has approved a billion package to help small businesses and hospitals and to expand covid testing it now goes to president trump's desk"
"383",2020-04-23,"a key coronavirus model often cited by the white house tweaked its projections and now says that some states must wait even longer to safely reopen follow live updates"
"384",2020-04-23,"there are at least cases of coronavirus in the us according to johns hopkins university's tally follow live updates"
"385",2020-04-23,"new york gov andrew cuomo reacts to senate majority leader mitch mcconnell who said he did not want to turn federal coronavirus relief into bailing out democratic states if there is ever a time for humanity and decency now is the time how irresponsible and how reckless"
"386",2020-04-23,"there are new coronavirus cases linked to a texas beef plant"
"387",2020-04-23,"sen elizabeth warren says her oldest brother don reed has died from coronavirus"
"388",2020-04-23,"nearly all coronavirus patients at new york's largest health system who needed ventilators to help them breathe died a study showed"
"389",2020-04-22,"president trump said he disagreed with gov brian kemp's decision to open up parts of georgia's economy while the coronavirus pandemic continues to threaten the state"
"390",2020-04-22,"the director of a federal vaccine agency says he was abruptly reassigned because he would not promote coronavirus treatments touted by the trump administration"
"391",2020-04-22,"las vegas mayor carolyn goodman called for businesses to reopen saying they should handle coronavirus precautions themselves that is their job"
"392",2020-04-22,"two cats in new york have tested positive for novel coronavirus making them the first pets in the us known to be infected"
"393",2020-04-22,"covid appears to be causing sudden strokes in young adults doctors say"
"394",2020-04-22,"us government employees have been targeted by hackers exploiting the coronavirus outbreak according to new data from google's security team"
"395",2020-04-22,"there are currently coronavirus cases on us navy warships and another have been hit by the virus but impacted crew members have recovered a senior navy official tells cnn"
"396",2020-04-22,"tyson is closing its largest pork plant indefinitely after it was linked to nearly coronavirus cases but the waterloo iowa mayor says it may be too late"
"397",2020-04-21,"cdc director robert redfield says there could be second possibly worse coronavirus outbreak this winter"
"398",2020-04-21,"the scripps national spelling bee has been canceled for the first time since world war ii because of the coronavirus pandemic"
"399",2020-04-21,"the un reports a driver was killed and a government official seriously injured after a world health organization vehicle carrying coronavirus test samples came under fire in myanmar's rakhine state"
"400",2020-04-21,"at least crew members from the uss theodore roosevelt have tested positive for covid the us navy says with nine of the sailors hospitalized"
"401",2020-04-21,"wisconsin health officials say that they have tied at least seven cases of covid to the state's inperson election on april follow live updates"
"402",2020-04-21,"lawmakers reach a deal on a bill to provide new funding for small businesses hurt by the coronavirus outbreak setting up a vote later today in the senate"
"403",2020-04-21,"new york gov cuomo says total hospitalizations of coronavirus patients in the state are basically flat though about new people were hospitalized monday follow live updates"
"404",2020-04-21,"the us food and drug administration issues an emergency use authorization for a new coronavirus diagnostic test that allows patients to collect their own samples at home and then mail those samples to a lab"
"405",2020-04-21,"spain's running of the bulls festival the san fermin fiesta held in pamplona every july has been canceled this year as a result of coronavirus"
"406",2020-04-21,"president trump says he will temporarily suspend immigration into the us by executive order because of coronavirus"
"407",2020-04-20,"dr anthony fauci urges caution about coronavirus antibody tests says more research is needed to determine whether someone who has recovered really is protected against future infection"
"408",2020-04-19,"bob lazier indy starter and cart's rookie of the year has died at due to complications from the coronavirus"
"409",2020-04-19,"us death toll from coronavirus surpasses according to a tally from johns hopkins university follow live updates"
"410",2020-04-19,"treasury secretary steven mnuchin says putting president trump's name on the coronavirus stimulus checks was his idea"
"411",2020-04-19,"a senior uk government figure defends prime minister boris johnson's approach to the coronavirus pandemic following a wideranging critique follow live updates"
"412",2020-04-19,"more than inmates have tested positive for coronavirus at three facilities in ohio officials say"
"413",2020-04-18,"new york gov andrew cuomo said that people in the state died over the past hours from coronavirus live updates"
"414",2020-04-17,"comiccon has canceled its premiere event in san diego because of the coronavirus pandemic the event scheduled for july has been held for years and draws about attendees a year"
"415",2020-04-17,"a california doctor faces a federal charge after allegedly selling covid treatment packs and saying a drug touted by president trump cures the disease"
"416",2020-04-17,"us stocks open sharply higher as investors get excited about a potential coronavirus drug and the reopening of the us economy"
"417",2020-04-17,"breaking president trump's former personal attorney michael cohen will be released early from prison due to the coronavirus pandemic"
"418",2020-04-16,"allen daviau an oscarnominated cinematographer for his work on films like et and the color purple dies at from complications related to covid"
"419",2020-04-16,"new york gov cuomo says the state's social distancing plan to help mitigate the spread of coronavirus will be extended in coordination with other states to may follow live updates"
"420",2020-04-16,"research into blood donors in the netherlands suggests that around of the dutch population may have developed antibodies against covid follow live updates"
"421",2020-04-16,"national security officials say the us is looking into the possibility that novel coronavirus originated in a chinese lab"
"422",2020-04-15,"maryland mandates face coverings in retail establishments and on public transportation tennessee schools will remain closed the rest of the academic year follow live coronavirus updates"
"423",2020-04-15,"on a business council call today industry leaders told the president that there would need to be guarantees of rampedup coronavirus testing before people return to work"
"424",2020-04-15,"us stocks set to open lower as investors continue to worry about the coronavirus pandemic's impact on the economy here's what is moving markets today"
"425",2020-04-15,"with the goal to measure the prevalence of the covid infection among the us population nearly employees within major league baseball have volunteered to be part of a nationwide coronavirus antibody study"
"426",2020-04-14,"us surpasses coronavirus cases according to johns hopkins university's tally of cases"
"427",2020-04-14,"trump halts us funding to the world health organization while a review into its handling of coronavirus is conducted"
"428",2020-04-14,"more than people have died in the us from coronavirus according to johns hopkins university's tally of cases"
"429",2020-04-14,"john h conway a renowned mathematician who created one of the first computer games has died of coronavirus complications"
"430",2020-04-14,"new york gov andrew cuomo says the threeday average for instate coronavirus hospitalizations is down slightly adding that officials believe the apex is here follow live updates"
"431",2020-04-14,"the us food and drug administration authorizes a saliva test for diagnosing covid in emergencies"
"432",2020-04-14,"the coronavirus pandemic is plunging the global economy into its deepest slump since the great depression of the s the international monetary fund says"
"433",2020-04-14,"at least us service members have tested positive for covid follow live updates on the pandemic"
"434",2020-04-14,"a third of nhs staff and key workers tested for coronavirus in the uk have returned positive results new british government data shows"
"435",2020-04-14,"indian prime minister modi has extended the country's nationwide lockdown until may in a bid to contain the continued spread of the coronavirus"
"436",2020-04-13,"wyoming becomes the th us state to report a coronavirusrelated death"
"437",2020-04-12,"stanley chera a new york city real estate developer and friend of president trump has died of complications related to covid"
"438",2020-04-12,"walt disney world will furlough employees in orlando amid the coronavirus pandemic"
"439",2020-04-12,"one of the country's largest pork processing facilities is closing until further notice as employees fall ill with covid putting the us meat supply at risk"
"440",2020-04-12,"dr anthony fauci says some lives would have been saved if mitigation efforts to control the coronavirus pandemic had been instituted earlier"
"441",2020-04-12,"uk prime minister boris johnson has been discharged from the hospital to continue his recovery from coronavirus a downing street spokesperson says follow live updates"
"442",2020-04-12,"the uk is likely to be one of the worst if not the worst affected countries in europe's coronavirus outbreak a uk government adviser says follow live updates"
"443",2020-04-11,"crew members from the uss theodore roosevelt aircraft carrier have tested positive for coronavirus the us navy says"
"444",2020-04-11,"new york city public schools will remain closed through the end of this academic year due to coronavirus concerns mayor bill de blasio says follow live updates"
"445",2020-04-11,"celebrity attorney michael avenatti has been released from federal jail temporarily due to coronavirus concerns follow live updates"
"446",2020-04-10,"the global death toll from coronavirus is now more than people according to a johns hopkins university tally"
"447",2020-04-10,"new york gov cuomo says he is cautiously optimistic that the state's coronavirus infection rate is slowing with confirmed deaths thursday down from the day before"
"448",2020-04-10,"dr anthony fauci says the idea of americans carrying certificates of immunity to prove they have tested positive for coronavirus antibodies might have some merit follow live updates"
"449",2020-04-09,"utah's governor orders all adults entering the state to disclose their travel plans in the latest stateled crackdown on domestic travel due to coronavirus"
"450",2020-04-09,"the american heart association issues a new set of guidelines for emergency workers responding to cardiac arrest victims in the coronavirus pandemic"
"451",2020-04-09,"at least people across new york state died of coronavirus wednesday the highest singleday death rate so far gov andrew cuomo says follow lives updates"
"452",2020-04-09,"us navy official tells cnn that sailors from the uss theodore roosevelt have tested positive for coronavirus"
"453",2020-04-09,"another million people filed for unemployment benefits last week as us workers continue to suffer from job losses furloughs and reduced hours during the coronavirus pandemic"
"454",2020-04-08,"the novel coronavirus has infected more than million people and killed more than worldwide according to a tally from johns hopkins university"
"455",2020-04-08,"cnn poll public views of the economy have plummeted and about half of americans say they have faced financial hardship due to the coronavirus outbreak"
"456",2020-04-08,"more than people have died in the us from coronavirus with at least reported cases"
"457",2020-04-08,"new york gov cuomo says the state will do more coronavirus testing in minority communities follow live updates"
"458",2020-04-08,"dr deborah birx the white house coronavirus response coordinator says officials are looking at whether social distancing guidelines could be relaxed in some areas at the end of the month follow live updates"
"459",2020-04-08,"john prine the grammywinning singersongwriter who influenced legions of musicians has died from coronavirus complications he was"
"460",2020-04-07,"jersey city councilman michael yun a longtime civic and business leader in the community has died from coronavirus complications"
"461",2020-04-07,"republican sen rand paul says he is successfully recovered from his bout with coronavirus and is now volunteering at a hospital"
"462",2020-04-07,"trump removes acting defense department inspector general glenn fine as chair of the committee overseeing trillion in emergency coronavirus funding"
"463",2020-04-07,"new york reports its largest singleday increase in coronavirus deaths the state's death toll is now over follow live updates"
"464",2020-04-07,"british prime minister boris johnson has been receiving oxygen treatment for coronavirus in intensive care a senior member of the cabinet confirmed"
"465",2020-04-06,"us stocks had their best day in two weeks closing near session highs on optimism about a slowdown in new coronavirus infections the dow finished up or points the sampp closed higher the nasdaq composite ended up"
"466",2020-04-06,"uk prime minister boris johnson is in intensive care a day after being hospitalized with coronavirus"
"467",2020-04-06,"the united states has at least reported deaths from coronavirus according to a tally by johns hopkins university"
"468",2020-04-06,"the acting secretary of the navy calls the nowousted commander of the uss theodore roosevelt stupid over coronavirus memo"
"469",2020-04-06,"us stocks rallied at monday's open following some encouraging data that showed a slowdown in coronavirus infections in multiple countries follow live updates"
"470",2020-04-06,"italy has recorded its lowest oneday coronavirus death toll in two weeks with deaths the italian civil protection ministry said sunday"
"471",2020-04-05,"nadia a yearold malayan tiger at the bronx zoo in new york tested positive for coronavirus this is the first known instance of a tiger being infected the usda says"
"472",2020-04-05,"uk prime minister boris johnson was admitted to the hospital for precautionary tests he has already tested positive for coronavirus"
"473",2020-04-05,"the number of coronavirus deaths in new york has been dropping for the first time but the significance of that is too early to tell gov cuomo says"
"474",2020-04-05,"esper on the firing of a navy commander after writing a memo saying that crew needed help after the coronavirus hit his ship i think acting secretary modly made a very tough decision it is just another example how we hold leaders accountable for their actions cnnsotu"
"475",2020-04-05,"defense secretary mark esper discusses the department of defense's plan to support new york city through the coronavirus pandemic what we plan on doing is deploying over additional doctors and nurses and other medical professionals to new york cnnsotu"
"476",2020-04-04,"revered women's shoe designer sergio rossi has died of coronavirus complications at the age of according to a hospital in northern italy"
"477",2020-04-03,"the supreme court postpones remaining two weeks of oral arguments due to coronavirus says trump financials and other delayed cases may be rescheduled"
"478",2020-04-03,"cnn anchor brooke baldwin has been diagnosed with coronavirus she said chills aches and a fever came on suddenly thursday"
"479",2020-04-03,"new york gov andrew cuomo reports the state's biggest singleday increase of coronavirus deaths follow live updates"
