"","created_at","text"
"648",2020-03-16,"bernie sanders let us be honest and understand that this coronavirus pandemic exposes the incredible weakness and dysfunctionality of our current health care system demdebate"
"649",2020-03-16,"bernie sanders on what he would do as president to help americans amid the coronavirus pandemic well the first thing we have got to do whether or not i am president is to shut this president up right now demdebate"
"650",2020-03-16,"biden on confronting coronavirus crisis we have to deal with the economic fallout quickly and that means making sure the people who in fact lose their job do not get a paycheck can not pay their mortgage are able to pay it and pay them now demdebate"
"651",2020-03-15,"nyc public schools the nation's largest school district will temporarily shut down in response to the coronavirus"
"652",2020-03-15,"breaking in a bold action to support the economy during the coronavirus outbreak the us federal reserve announced it would cut its target interest rate to zero"
"653",2020-03-15,"nike urban outfitters and other retailers plan to temporarily close stores over coronavirus concerns"
"654",2020-03-15,"there are now at least us coronavirus cases and people across the nation have died in the outbreak only one us state has yet to report a case follow live updates"
"655",2020-03-15,"a cruise ship carrying more than passengers with at least five confirmed coronavirus cases on board is frantically searching for somewhere to dock after it was refused entry at several caribbean ports"
"656",2020-03-15,"the odds are this is going to go on a lot longer and it would not surprise me at all if schools did not open again this year ohio govmikedewine says about the longterm impact of the coronavirus cnnsotu"
"657",2020-03-15,"us citizens returning from overseas say they are waiting hours for coronavirus screening at airports"
"658",2020-03-15,"a player for the detroit pistons tested positive for coronavirus the team announced this is the third nba player to test positive"
"659",2020-03-14,"just in president trump has tested negative for the coronavirus the white house says"
"660",2020-03-14,"new georgia becomes the second state to postpone its presidential primary due to the coronavirus"
"661",2020-03-14,"israel has further tightened coronavirus restrictions including limiting gatherings to people and closing all leisure and entertainment venues effective sunday morning"
"662",2020-03-14,"france will close all restaurants cafes cinemas and clubs to combat the spread of coronavirus the prime minister says"
"663",2020-03-14,"president trump is considering some domestic travel restrictions specifically with regards to certain areas hard hit with the coronavirus"
"664",2020-03-14,"trump says he is been tested for coronavirus vice president pence says travel to the us from the uk and ireland will be restricted"
"665",2020-03-14,"vice president mike pence will hold a pm et news conference with members of the coronavirus task force from the white house"
"666",2020-03-14,"the united kingdom department of health and social care confirms a total of people have died after contracting coronavirus"
"667",2020-03-14,"an yearold woman who tested positive for coronavirus died in a new york city hospital friday gov andrew cuomo says marking the state's first coronavirusrelated death"
"668",2020-03-14,"georgia gov brian kemp declares a public health state of emergency after his state saw the largest increase of coronavirus cases in a hour period to date"
"669",2020-03-14,"just in house passes coronavirus relief bill after president trump announces his support"
"670",2020-03-14,"the white house physician said in a memo that trump does not need to be quarantined after interactions with people who tested positive for coronavirus"
"671",2020-03-14,"google will not be publishing a nationalscale website for coronavirus testing anytime soon contrary to claims made by president trump during a news conference"
"672",2020-03-13,"house speaker nancy pelosi says a deal has been reached with the white house to pass a coronavirus response bill"
"673",2020-03-13,"read text of president trump's national emergency declaration over the coronavirus"
"674",2020-03-13,"president trump says he is experiencing no symptoms of the coronavirus despite contact with an infected brazilian official"
"675",2020-03-13,"president trump says he does not support the current house coronavirus bill we just do not think they are giving enough we do not think the democrats are giving enough we are negotiating"
"676",2020-03-13,"trump claims private sector will provide million coronavirus tests within a month follow live updates"
"677",2020-03-13,"president trump declares a national emergency to combat the coronavirus i'm urging every state to set up emergency operation centers effectively immediately"
"678",2020-03-13,"denmark will temporarily close its borders to noncitizens in a move to curb the spread of coronavirus the prime minister says"
"679",2020-03-13,"president trump is likely to make an emergency declaration this afternoon a move that would free up more federal resources to combat coronavirus according to two people familiar with the decision"
"680",2020-03-13,"president trump will hold a news conference about coronavirus at pm et today"
"681",2020-03-13,"michigan is closing all k school buildings until april as part of the state's efforts to slow the spread of the coronavirus"
"682",2020-03-13,"canadian prime minister justin trudeau's wife sophie has tested positive for coronavirus the prime minister does not have symptoms but will be in isolation for days"
"683",2020-03-13,"disney is closing walt disney world its flagship theme park resort in florida because of the coronavirus outbreak the company closed its disneyland resort earlier in the day"
"684",2020-03-12,"the church of jesus christ of latterday saints has decided to suspend all public gatherings around the world until further notice due to coronavirus"
"685",2020-03-12,"new york state will have the first public drivethrough coronavirus testing facility on the east coast the governor says"
"686",2020-03-12,"all kentucky public and private schools to cease inperson classes for at least two weeks because of coronavirus"
"687",2020-03-12,"all catholic churches across rome to completely close due to coronavirus"
"688",2020-03-12,"maryland will close all schools for two weeks starting monday and the governor has activated the national guard in the state in response to coronavirus"
"689",2020-03-12,"disneyland in anaheim california is closing due to the coronavirus outbreak the closure follows disney shuttering some of its parks overseas because of the virus"
"690",2020-03-12,"the ncaa cancels march madness tournament due to coronavirus concerns"
"691",2020-03-12,"broadway shows will suspend all performances through april because of the coronavirus pandemic"
"692",2020-03-12,"france will close schools and is advising elderly people to stay at home to try and contain the spread of coronavirus the country's president announces"
"693",2020-03-12,"major league baseball has announced that the start of the season will be delayed by at least two weeks and has canceled the remaining spring training schedule due to coronavirus concerns"
"694",2020-03-12,"utah jazz star donovan mitchell says he is tested positive for coronavirus the nba suspended the season on news of a teammate's illness yesterday"
"695",2020-03-12,"the new york federal reserve vows to pump in over trillion to fight coronaviruslinked disruptions in markets follow live updates"
"696",2020-03-12,"schools colleges and childcare facilities will be closed in the republic of ireland from friday as part of a nationwide effort to halt the spread of coronavirus"
"697",2020-03-12,"twitter requires all employees globally to work from home due to coronavirus concerns"
"698",2020-03-12,"actor tom hanks says he and his wife actress rita wilson have been diagnosed with coronavirus"
"699",2020-03-12,"the nba is suspending the rest of the season after a player tests positive for coronavirus the league announces"
"700",2020-03-12,"trump will suspend all us travel to and from europe for the next days due to coronavirus but makes an exception for the uk"
"701",2020-03-11,"washington dc's mayor has declared a state of emergency after at least people have been diagnosed with coronavirus in the district"
"702",2020-03-11,"italy will close all restaurants bars and shops across the country in an effort to curb the spread of coronavirus the country's prime minister says supermarkets and pharmacies will stay open"
"703",2020-03-11,"us travel restrictions on europe are under discussion a homeland security official says due to coronavirus concerns"
"704",2020-03-11,"the ncaa recommends that march madness be played without spectators due to coronavirus concerns the tournament is scheduled to start march"
"705",2020-03-11,"the world health organization officially declares the coronavirus outbreak a pandemic"
"706",2020-03-11,"us stocks open in the red as worries about the coronavirus outbreak once again take over the dow opened points or lower the sampp kicked off lower the nasdaq composite fell"
"707",2020-03-11,"there are now at least coronavirus cases in the us a number that has doubled since sunday follow live updates"
"708",2020-03-10,"the coachella and stagecoach music festivals have been postponed until october due to coronavirus concerns follow live updates"
"709",2020-03-10,"google is asking all of its employees across north america to work from home through april due to coronavirus"
"710",2020-03-10,"the new york international auto show one of the most important for the auto industry in the us has been postponed due to coronavirus fears"
"711",2020-03-10,"walmart announced an emergency leave policy tuesday after one of its store associates in kentucky tested positive for coronavirus according to a company memo"
"712",2020-03-10,"joe biden and bernie sanders cancel rallies scheduled for tonight in cleveland over coronavirus concerns follow live updates"
"713",2020-03-10,"coachella will be delayed over coronavirus concerns two sources tell cnn the annual music event typically attracts about attendees per day to indio california"
"714",2020-03-10,"new york gov andrew cuomo announces plans for a containment area north of new york city as the state works to stop the spread of coronavirus"
"715",2020-03-10,"every country in the european union now has cases of coronavirus the european centre for disease prevention and control confirms follow live updates"
"716",2020-03-10,"wheel of fortune will go without a studio audience indefinitely out of concern over the spread of coronavirus a source close to the show says"
"717",2020-03-10,"new sec becomes the first federal agency to ask dc employees to work from home over potential coronavirus case"
"718",2020-03-09,"the whole country of italy is now on lockdown to protect citizens from coronavirus italian prime minister giuseppe conte says follow live updates"
"719",2020-03-09,"the new york stock exchange halted stock trading for minutes after the sampp fell on monday stocks plummeted as worries about the growing global coronavirus pandemic and an oil price race to the bottom weighed on global financial markets"
"720",2020-03-09,"global stocks are plummeting monday as the novel coronavirus outbreak and an oil crash rattle investors"
"721",2020-03-08,"connecticut confirms its first case of coronavirus and oregon's governor declares a state of emergency follow live updates"
"722",2020-03-08,"italy prohibits travel and cancels all public events in its northern region to contain coronavirus"
"723",2020-03-08,"there are now confirmed coronavirus cases in the us"
"724",2020-03-08,"currently there are about coronavirus tests available for the american public us surgeon general dr jerome adams says follow live updates"
"725",2020-03-08,"when first responders got to a washington nursing home hardhit by coronavirus they found an understaffed facility with inadequate gear attempting to serve dozens of vulnerable patients"
"726",2020-03-08,"iran coronavirus cases surge and the death toll reaches"
"727",2020-03-08,"italian prime minister has signed a decree that will put most of northern italy under lockdown because of the coronavirus outbreak"
"728",2020-03-07,"washington dc records its first presumptive positive coronavirus case according to the mayor's office follow live updates"
"729",2020-03-07,"a person who attended cpac last week tested positive for coronavirus many officials including trump and pence were also at the conference"
"730",2020-03-07,"confirmed cases of coronavirus in italy jump by in a day bringing the country's total to follow live updates"
"731",2020-03-07,"a navy sailor stationed in italy tested positive for coronavirus marking the first positive case of a us servicemember in europe"
"732",2020-03-06,"at least people aboard the grand princess cruise ship off the california coast tested positive for coronavirus vice president mike pence says"
"733",2020-03-06,"new cdc guidance says older adults and people with severe chronic medical conditions should stay at home as much as possible due to coronavirus"
"734",2020-03-06,"just in south by southwest the annual tech film and music conference in austin has officially been canceled because of the coronavirus"
"735",2020-03-06,"the white house cancels a presidential visit to the centers for disease control and prevention in atlanta citing the interference a trip may cause as the coronavirus outbreak grows"
"736",2020-03-06,"colorado officials announced a presumptive positive case of coronavirus the state's first case follow live updates"
"737",2020-03-05,"the us department of homeland security refused entry into the country to people within the past month because of the coronavirus dhs data shows"
"738",2020-03-05,"just in senate approves sweeping billion coronavirus response package"
"739",2020-03-04,"the house has passed an billion coronavirus response package with broad bipartisan support the legislation now moves to the senate"
"740",2020-03-04,"california records its first coronavirus death an elderly patient who had underlying health conditions follow live updates"
"741",2020-03-04,"italy is closing all schools and universities across the country until march in an effort to prevent the further spread of coronavirus"
"742",2020-03-04,"congressional lawmakers strike a deal on a multibillion dollar spending package to fund the us response to the coronavirus outbreak"
"743",2020-03-04,"vice president pence says the administration is sending new coronavirus guidance for nursing homes after a facility outside of seattle has become a hotbed of infections follow live updates"
"744",2020-03-04,"yeshiva university in new york says one of its students has tested positive for coronavirus the third reported case in the state follow live updates"
"745",2020-03-03,"us navy ships will stay at sea for at least days after visiting any port in europe in order to help prevent the spread of the coronavirus"
"746",2020-03-03,"the first presumptive case of coronavirus in north carolina is linked to a seattlearea nursing home facility where five residents were sick and later died officials say"
"747",2020-03-03,"google is canceling google io an annual developer conference and its biggest event of the year because of concerns about the coronavirus"
"748",2020-03-03,"breaking the federal reserve has slashed interest rates by half a percentage point amid concerns that the coronavirus outbreak could damage the us economy it is the first unscheduled emergency rate cut since"
"749",2020-03-02,"more people have died in the us from the novel coronavirus officials say bringing the total to all in washington state"
"750",2020-03-02,"the dow rallies more than points after last week's coronaviruslinked losses"
"751",2020-03-02,"almost times more coronavirus cases were reported outside china than inside in the last hours who says"
"752",2020-03-01,"president trump is expected to visit the cdc headquarters this week it is unclear if vice president pence who is in charge of the administration's response to the coronavirus outbreak will join him"
"753",2020-03-01,"rhode island confirms its first presumptive coronavirus case state health officials say the unidentified individual had traveled to italy in midfebruary follow live updates"
"754",2020-03-01,"this is really a time for us to come together vice president mike pence says on concerns of politicizing the coronavirus because remember we are talking about the health and lives of the american people cnnsotu"
"755",2020-03-01,"president trump in a tweet announces people will be screened for coronavirus upon arriving in the us if they are traveling from highrisk countries follow live updates"
"756",2020-02-29,"the us surgeon general urged people to stop buying face masks saying they are not effective in preventing the general public from getting coronavirus but that a shortage could mean they are not available to healthcare providers who are most at risk"
"757",2020-02-29,"the trump administration announces new travel restrictions for iran italy and south korea in response to the spread of coronavirus"
"758",2020-02-29,"one person with coronavirus has died washington state health officials say this is the first death in the us from the disease follow live updates"
"759",2020-02-29,"a presumptive case of coronavirus in oregon is thought to be the third in the us from community transmission but the cdc has not yet confirmed the state's test"
"760",2020-02-29,"a case of coronavirus in california is the second in the us of unknown origin health officials say"
"761",2020-02-28,"the dow opened points down marking its seventhstraight day in the red as coronavirus fears continue to mount"
"762",2020-02-28,"a woman in her s is the fifth passenger on the diamond princess cruise ship to die from coronavirus japan's health ministry says"
"763",2020-02-28,"next week's geneva motor show has been canceled over coronavirus fears more than people typically attend"
"764",2020-02-28,"parts of iran affected by the novel coronavirus have cancelled friday prayers a decision made only in exceptional circumstances"
"765",2020-02-28,"south korea has confirmed an additional cases of the novel coronavirus bringing the national total to cases the largest outbreak outside of mainland china"
"766",2020-02-28,"the us navy has ordered all ships that have visited countries in the pacific region to effectively selfquarantine and remain at sea for days in order to monitor sailors for any coronavirus symptoms"
"767",2020-02-27,"a health and human services whistleblower claims us workers did not have proper training or protective gear when they received coronavirus evacuees from china"
"768",2020-02-27,"just in the dow plunged more than points and closed in the red as worries about the coronavirus mounted it was the index's worst oneday point drop in history"
"769",2020-02-27,"saudi arabia suspends pilgrimages to islam's holiest sites for people outside the country over novel coronavirus fears"
"770",2020-02-27,"i would think usually you might put a medical professional in charge amy klobuchar reacts to president trump putting vice president pence in charge of the effort to prevent a coronavirus outbreak in the us cnntownhall"
"771",2020-02-26,"a yearold man who arrived in brazil from italy is latin america's first coronavirus patient authorities are mapping who he had contact with follow live updates"
"772",2020-02-26,"bernie sanders and joe biden go after president trump on his coronavirus response demdebate"
"773",2020-02-25,"the dow tumbles points as coronavirus fears continue"
"774",2020-02-25,"the coronavirus has met two of three criteria for a global pandemic and containment at us borders is harder and harder the cdc says"
"775",2020-02-25,"the latest tally of novel coronavirus cases in the united states has jumped to the cdc says the new total now includes passengers from the diamond princess cruise ship"
"776",2020-02-23,"italian authorities announce sweeping closures in the country's north as they scramble to contain europe's biggest coronavirus outbreak and search for patient zero"
"777",2020-02-21,"eleven americans who were evacuated from a cruise ship in japan tested positive for coronavirus in omaha nebraska the hospital says"
"778",2020-02-20,"two passengers of the diamond princess cruise ship have died from the coronavirus officials say follow live updates"
"779",2020-02-18,"the coronavirus has now killed more than people across the globe and sickened more than follow live updates"
"780",2020-02-18,"the number of coronavirus cases worldwide tops after china reports more than new confirmed cases follow live updates for the latest on the outbreak"
"781",2020-02-17,"apple says the coronavirus outbreak is limiting how many devices it can make and sell in china and that it does not expect to meet revenue projections it provided last month"
"782",2020-02-17,"delta air lines says it is contacting passengers who were on a recent flight between honolulu and nagoya japan after reports that two passengers are being treated for coronavirus"
"783",2020-02-17,"nearly half of china's population million people is living under some form of travel restrictions due to the coronavirus outbreak according to analysis done by cnn follow live updates"
"784",2020-02-17,"more people from the diamond princess cruise ship have tested positive for novel coronavirus japanese officials say it's the largest singleday increase of cases stemming from the ship to date"
"785",2020-02-17,"fourteen americans from the diamond princess who are on government charter flights back to the us have tested positive for coronavirus"
"786",2020-02-16,"people died due to the coronavirus in china's hubei province sunday bringing the global death toll to more than people worldwide have contracted the virus"
"787",2020-02-16,"italian foreign minister luigi di maio announces his government is planning to bring back italians currently quarantined on the diamond princess cruise in japan due to the coronavirus outbreak follow live updates"
"788",2020-02-15,"the us government is preparing to evacuate americans who have been quarantined on a cruise ship in japan for over a week after dozens on board tested positive for novel coronavirus earlier this month"
"789",2020-02-15,"a chinese tourist in france has died becoming the first person to die from the novel coronavirus in europe follow live updates"
"790",2020-02-15,"the us will evacuate the roughly americans on the diamond princess cruise ship under quarantine in japan because of coronavirus the wall street journal reports"
"791",2020-02-15,"san diego county in california has declared a precautionary local emergency because of concerns over the novel coronavirus county officials said"
"792",2020-02-13,"novel coronavirus can be spread by people who aren't exhibiting symptoms the director of the us centers for disease control and prevention confirms"
"793",2020-02-13,"the cruise ship that was refused entry by four countries despite having no coronavirus cases onboard has finally been allowed to dock in cambodia and let its passengers disembark"
"794",2020-02-13,"china recorded more than new coronavirus infections in one day the rise comes from a tweak in how authorities are tallying infections follow live updates"
"795",2020-02-12,"the chinese grand prix originally scheduled for april is postponed due to the deadly coronavirus outbreak formula one announces"
"796",2020-02-11,"the quarantine has ended for all coronavirus evacuees at a california air force base and officials say the group poses no health risk follow live updates"
"797",2020-02-11,"federal reserve chairman jerome powell warns congress that the coronavirus could hurt the global economy follow live updates"
"798",2020-02-11,"the first us evacuee from china known to be infected with the wuhan coronavirus was mistakenly released from a san diego hospital"
"799",2020-02-10,"the global death toll from wuhan coronavirus has passed according to authorities more than people have been infected follow the latest updates"
"800",2020-02-09,"the global death toll from the wuhan coronavirus is at least people surpassing the number of fatalities from the deadly sars outbreak follow live updates"
"801",2020-02-08,"on the deadliest day of the wuhan coronavirus outbreak with fatalities in mainland china the us embassy confirmed the first death of a us citizen from the virus"
"802",2020-02-07,"a chicagoarea husband and wife who were treated for coronavirus have been discharged and are in isolation at their home a hospital spokesperson says"
"803",2020-02-07,"four passengers on a royal caribbean cruise ship docked near new york city were taken to a hospital for further evaluation for the coronavirus new jersey gov phil murphy says"
"804",2020-02-07,"an additional people have tested positive for the coronavirus on the cruise ship currently docked and quarantined in japan's yokohama bay bringing the total to at least infections on board"
"805",2020-02-06,"update the chinese doctor who warned the public about the wuhan coronavirus has died of the illness the hospital treating him said the statement came after hours of confusion in state media reports"
"806",2020-02-06,"update a chinese doctor who sounded the alarm about coronavirus is critically ill the hospital treating him says state media earlier said he had died"
"807",2020-02-06,"a chinese doctor who was targeted by police after warning the public early on about the deadly coronavirus has died from the illness"
