"","created_at","text"
"162",2020-06-19,"florida reports nearly new coronavirus cases a record singleday increase for the state follow live updates"
"163",2020-06-19,"the uk's covid alert level has been lowered from level four to level three follow live updates"
"164",2020-06-19,"a cdc forecast projects total coronavirus deaths in the united states by july with deaths increasing in nine states"
"165",2020-06-18,"germany is racing to stop a new coronavirus outbreak after workers at an abattoir in the western state of north rhinewestphalia tested positive for covid"
"166",2020-06-17,"new york city is on track to begin phase two of reopening monday gov andrew cuomo says phase two allows for a wider range of businesses to continue to reopen under covid guidelines according to the state's reopening website"
"167",2020-06-17,"a special disinfectant tunnel has been installed in russian president vladimir putin's house to protect him from coronavirus state media reported the tunnel is designed to disinfect everyone passing through it with a fine water mist"
"168",2020-06-16,"the steroid dexamethasone can save one life for every eight patients treated for covid with the whole treatment only costing around dollars one of the leaders of the oxford university study said at a uk government briefing"
"169",2020-06-16,"kids and teens are estimated to be about half as likely to get infected by coronavirus than those aged or over a new study shows"
"170",2020-06-16,"dr anthony fauci says he last spoke to president trump two weeks ago other key members of the coronavirus task force such as drs deborah birx and robert redfield also are far less visible than they were during the early weeks of the pandemic"
"171",2020-06-16,"the widely available steroid drug dexamethasone may be key in helping to treat the sickest covid patients in the hospital who require ventilation or oxygen according to preliminary findings from researchers in the united kingdom"
"172",2020-06-16,"new zealand has reported its first coronavirus cases in more than three weeks after two women who traveled to the country from the uk were found to have covid"
"173",2020-06-16,"a coronavirus model is forecasting that there will be more than total deaths in the united states by october"
"174",2020-06-15,"the academy awards will be delayed for the first time in years extending eligibility for films after covid shut down productions and theaters"
"175",2020-06-15,"several players for the dallas cowboys and houston texans have tested positive for coronavirus sources tell the nfl network"
"176",2020-06-15,"the world health organization says a coronavirus cluster of more than cases in beijing is a significant event that needs to be investigated follow live updates"
"177",2020-06-15,"the fda pulls its emergency use authorization of hydroxychloroquine for covid treatment citing the latest scientific evidence"
"178",2020-06-15,"us stocks tumble at the opening bell as investors continue to worry about a potential second wave of coronavirus infections"
"179",2020-06-15,"gym chain hour fitness files for bankruptcy permanently closing us locations after the covid pandemic forced its clubs to shut down for months"
"180",2020-06-14,"new york has received complaints of noncompliance with reopening rules as the covid pandemic continues gov andrew cuomo says"
"181",2020-06-14,"trump's tulsa campaign rally site has canceled or postponed all other events until the end of july due to covid concerns"
"182",2020-06-14,"current unemployment benefits stemming from the coronavirus stimulus package are a disincentive says white house economic adviser larry kudlow we are paying people not to work it is better than their salaries would get cnnsotu"
"183",2020-06-12,"there have been a record number of covid cases reported in arkansas in the last hours the governor says"
"184",2020-06-11,"us stocks plummeted on thursday as the dow closed points or lower all three major us indexes recorded their worst day since the big coronavirus selloff in march"
"185",2020-06-11,"as other states see increasing covid cases new york gov andrew cuomo warns we need caution"
"186",2020-06-11,"a medicine that may treat and prevent covid is now being tested in patients in multiple sites around the us regeneron pharmaceuticals inc announced if successful regeneron hopes it could be available by the fall"
"187",2020-06-11,"there are more than two million cases of coronavirus in america according to a tally by johns hopkins university"
"188",2020-06-10,"disneyland and disney california adventure plan to begin a phased reopening on july after months of being closed because of the coronavirus outbreak"
"189",2020-06-10,"president trump says he will host his first rally in months next week in oklahoma and plans to visit four other states in the coming weeks he has not held a rally since early march when all inperson campaign events were halted due to covid concerns"
"190",2020-06-10,"dr anthony fauci the nation's top infectious diseases expert said the world health organization was not correct in suggesting covid transmission from an asymptomatic person to an uninfected person is very rare"
"191",2020-06-10,"people are split on whether they're comfortable returning to their regular routines nearly three months after the covid pandemic caused a widespread shutdown of life in america a cnn poll shows"
"192",2020-06-09,"a world health organization official clarifies after describing asymptomatic transmission of covid as being rare maria van kerkhove who's technical lead for coronavirus response now says this is a major unknown about asymptomatic cases"
"193",2020-06-09,"more than people in the uk have now died after contracting coronavirus according to the respective national statistics offices of england and wales scotland and northern ireland"
"194",2020-06-08,"children in vermont have tested positive for coronavirus after a new outbreak was reported last week"
"195",2020-06-08,"new york mayor de blasio says all indicators of the covid virus are under their thresholds as the city enters phase one of reopening follow live updates"
"196",2020-06-08,"oil giant bp will cut almost of its workforce globally as it looks to reduce costs as a result of the coronavirus pandemic follow live updates"
"197",2020-06-07,"new york is within the parameters for coronavirus cases and hospitalizations it needs to start reopening monday the mayor said"
"198",2020-06-07,"the cdc says it is closely monitoring the demonstrations happening across the us as concerns grow that the protests like other gatherings could spur additional coronavirus transmission"
"199",2020-06-07,"global coronavirus deaths top"
"200",2020-06-05,"about a third of americans surveyed by the us centers for disease control and prevention have used some kind of risky cleaning practice to stop the spread of covid the cdc says"
"201",2020-06-05,"a member of the ohio national guard who is in washington dc has been suspended after the fbi uncovered information that the guardsman expressed white supremacist ideology on the internet"
"202",2020-06-05,"the uk's health secretary says he was appalled by george floyd's death but asks people to not attend planned antiracism protests due to the coronavirus threat follow live updates"
"203",2020-06-05,"the us unemployment rate surprisingly fell to in may as covid restrictions eased in some areas the economy added million jobs"
"204",2020-06-05,"minnesota's governor is asking everyone who has protested the death of george floyd to be checked for coronavirus"
"205",2020-06-03,"on the heels of studies showing hydroxychloroquine does not help patients in the hospital with covid a new study the first of its kind shows the drug does not work to prevent infection with the virus either"
"206",2020-06-03,"the who says coronavirus is not mutating to become more dangerous but that does not mean the pandemic is not becoming more dangerous"
"207",2020-06-03,"the who committee recommends continued study of hydroxychloroquine as a potential covid treatment"
"208",2020-06-03,"a new covid study links obesity with a higher risk of children getting more severely ill"
"209",2020-06-03,"new york state records its lowest daily coronavirus death toll so far with deaths reported tuesday gov andrew cuomo says"
"210",2020-06-03,"cyclone nisarga has made landfall with wind speeds of up to kph mph according to the india meteorological department covid patients were among over people evacuated as the cyclone advanced toward mumbai"
"211",2020-06-03,"more than people including covid patients are being evacuated from lowlying coastal areas in india's western states ahead of a cyclone set to make landfall near mumbai"
"212",2020-06-03,"oklahoma state linebacker amen ogbongbemiga says he has tested positive for covid after attending a protest"
"213",2020-06-03,"peru reports more than new covid cases"
"214",2020-06-03,"president trump says the gop will be forced to find a new state to host their convention because north carolina is standing by coronavirus measures"
"215",2020-06-02,"warmer weather is unlikely to stop the spread of coronavirus the director of the national institutes of health says in a blog post follow live updates"
"216",2020-06-02,"eli lilly and company says it has started the first human trial of an antibody therapy designed to treat the novel coronavirus if the trial shows the treatment is effective against covid it could be available by autumn according to the company"
"217",2020-06-02,"washington dc reported a spike of coronavirus cases pushing back the city's timetable for moving to the second phase of reopening additional businesses and public spaces follow live updates"
"218",2020-05-31,"the world health organization has released new guidance for outdoor events and mass gatherings during the coronavirus pandemic"
"219",2020-05-30,"new york gov andrew cuomo signs a bill giving death benefits to families of frontline workers who died battling the coronavirus pandemic"
"220",2020-05-30,"a person who partied in the lake of the ozarks missouri area on memorial day weekend has tested positive for coronavirus and was possibly infectious over the holiday weekend"
"221",2020-05-29,"the supreme court has rejected an appeal from a louisiana inmate who argued that a state prison was not doing enough to protect him from catching covid"
"222",2020-05-28,"california is reporting the largest singleday increase in confirmed cases since the beginning of the covid pandemic"
"223",2020-05-28,"wearing a mask at home could help stop coronavirus spread among family members a new study says"
"224",2020-05-28,"north carolina had one of its highest days of reported deaths and hospitalizations since the covid crisis began the governor says"
"225",2020-05-28,"six feet of distance may not be enough to prevent coronavirus transmission experts say adding that the world needs to take airborne transmission of the virus seriously"
"226",2020-05-28,"in a matter of months the coronavirus crisis has exploded into a pandemic of historic proportions a timeline of this grim reality reveals a country trying to come to terms with the crisis while the death toll continues to rise"
"227",2020-05-27,"more than people have now died in the united states from the coronavirus according to figures from johns hopkins university"
"228",2020-05-27,"dr anthony fauci says he thinks a coronavirus vaccine could still be on track for the end of follow live updates"
"229",2020-05-27,"mexico has recorded its largest singleday increases in both newly confirmed cases and reported deaths from coronavirus since the outbreak began"
"230",2020-05-26,"brazil has surpassed the united states' daily coronavirus death toll"
"231",2020-05-26,"antibody tests used to determine if people have been infected in the past with covid might be wrong up to half the time the cdc says"
"232",2020-05-26,"latin america has surpassed europe and the united states in the daily number of reported covid infections the director of the pan american health organization says"
"233",2020-05-26,"los angeles county california will appoint an independent inspector general to oversee nursing homes throughout the coronavirus outbreak"
"234",2020-05-26,"new york reports people died from coronavirus yesterday gov cuomo says it is the lowest singleday toll since this started follow live updates"
"235",2020-05-25,"a marylandbased company says it will begin human testing on a potential covid vaccine it is the th company to start human trials around the world"
"236",2020-05-25,"italy records new confirmed cases of coronavirus in hours officials say the lowest daily number since february"
"237",2020-05-25,"the world health organization temporarily halts studying hydroxychloroquine as a potential covid treatment because of safety concerns"
"238",2020-05-24,"foreign athletes from multiple pro sports leagues will be exempt from restrictions on travel to the us during the coronavirus pandemic the acting dhs secretary says"
"239",2020-05-23,"about of moscow's residents are estimated to have the antibody for coronavirus the city's health authorities say"
"240",2020-05-23,"new york gov andrew cuomo reports new coronavirusrelated deaths as hospitalizations continue to fall in the state"
"241",2020-05-22,"basketball legend and current georgetown men's coach patrick ewing says he has tested positive for covid"
"242",2020-05-22,"president trump will donate his salary from this quarter to the department of health and human services to help develop therapies for treating and preventing covid his press secretary says"
"243",2020-05-22,"moderna's stock price skyrocketed as much as after the biotech company announced promising early results for its coronavirus vaccine then two top executives dumped nearly million in stocks"
"244",2020-05-22,"seriously ill covid patients treated with the drug touted by trump had a higher risk of dying in the hospital a large hydroxychloroquine study finds"
"245",2020-05-21,"president trump says flags will be lowered to halfstaff over the next three days to honor coronavirus victims"
"246",2020-05-21,"british health care workers are taking part in a global clinical trial to test the effectiveness of antimalarial drugs chloroquine and hydroxychloroquine against coronavirus"
"247",2020-05-21,"global coronavirus cases have surpassed million according to johns hopkins university data"
"248",2020-05-21,"peru has surpassed confirmed coronavirus cases the country's ministry of health says peru is second to brazil for the highest number of coronavirus cases in latin america"
"249",2020-05-21,"appeals court temporarily blocks order that would allow texans afraid of catching the coronavirus to vote by mail"
"250",2020-05-20,"dutch authorities believe a mink may have infected a human with covid"
"251",2020-05-20,"a texas federal judge rules that all voters including those afraid of catching the novel coronavirus can request absentee mailin ballots due to the pandemic"
"252",2020-05-19,"brazil recorded its highest number of coronavirus deaths and cases in one day according to the country's health ministry"
"253",2020-05-19,"uss theodore roosevelt is expected to return to sea this week following a major coronavirus outbreak"
"254",2020-05-19,"president trump says he is considering a travel ban on latin america and called the high number of us covid cases a badge of honor because it means the us is testing more people"
"255",2020-05-19,"global carbon emissions drop during coronavirus lockdowns"
"256",2020-05-19,"federal reserve chair powell and treasury secretary mnuchin face a senate grilling on stimulus spending during the covid crisis follow live updates"
"257",2020-05-19,"the seychelles says it is banning all cruise ships through the end of next year to help prevent the spread of coronavirus"
"258",2020-05-19,"a key coronavirus model revises its us death projection slightly downward predicting that people will die by august"
"259",2020-05-18,"president trump says he is taking hydroxychloroquine even though several recent studies show the drug is ineffective against the coronavirus and may even be harmful"
"260",2020-05-18,"there have been more than deaths from coronavirus in the us and more than million cases a count by johns hopkins university shows"
"261",2020-05-18,"the navajo nation spanning part of three states surpasses new york and new jersey for the highest percapita coronavirus infection rate in the us"
"262",2020-05-18,"minnesota reported nine new coronavirus deaths today the lowest number in two weeks state health department data show its stayathome order expired today"
"263",2020-05-18,"new york could face a billion tax revenue shortfall over the next two years because of coronavirus restrictions the city's independent budget office says"
"264",2020-05-18,"all but two us states have loosened restrictions in place to help curb the spread of coronavirus follow live updates"
"265",2020-05-17,"the number of coronavirusrelated hospitalizations in the uk is down from a week ago official says"
"266",2020-05-17,"white house trade adviser peter navarro slams the cdc saying it let the country down on coronavirus testing"
"267",2020-05-17,"social distancing worked to limit the spread of coronavirus in the us and may have prevented tens of millions of infections a new study finds"
"268",2020-05-17,"hhs secretary alex azar says that the high number coronavirus mortalities in the united states is due to greater risk profiles in certain communities and says the american response to the virus has been historic cnnsotu"
"269",2020-05-17,"texas reports its largest singleday number of positive covid cases since the beginning of pandemic"
"270",2020-05-17,"the uk government is close to reaching its target of recruiting contact tracers to help health authorities understand who may have been exposed to covid patients"
"271",2020-05-16,"eight sailors from the aircraft carrier uss theodore roosevelt who previously had coronavirus have tested positive for it again a defense official says"
"272",2020-05-16,"the us food and drug administration has authorized an athome sample collection kit that can be sent to specific labs for coronavirus testing follow live updates"
"273",2020-05-16,"the house passes a trillion coronavirus relief bill despite opposition from republicans and some democrats the senate is not expected to take it up"
"274",2020-05-15,"jcpenney files for bankruptcy the covid crisis is the final blow to a yearold company struggling to overcome a decade of bad decisions executive instability and damaging market trends"
"275",2020-05-15,"the cdc director says the department's models predict more than us covid deaths by june"
"276",2020-05-15,"president trump has named former pharmaceutical executive moncef slaoui and army gen gustave perna to lead operation warp speed the effort to develop a coronavirus vaccine"
"277",2020-05-15,"a yearold boy is the first reported child in france to die from a new syndrome possibly linked to coronavirus follow live updates from around the world"
"278",2020-05-15,"us retail sales fell a record in april underscoring just how badly retailers are struggling during the coronavirus crisis"
"279",2020-05-14,"cook county illinois has replaced queens county new york as the single us county with the highest number of coronavirus cases according to a johns hopkins university tally follow live updates"
"280",2020-05-14,"new york's department of health is looking into more than cases of covidrelated illness in children gov cuomo says patients range in age from less than years old to years old"
"281",2020-05-14,"some countries are seeing a spike in known coronavirus deaths others are struggling to find a path to normalcy"
"282",2020-05-14,"the pentagon has removed its lead official responsible for executing the defense production act to increase production of key equipment to combat coronavirus"
"283",2020-05-14,"sen richard burr is stepping down as chair of the intelligence committee while under investigation for making stock trades after covid briefings"
"284",2020-05-14,"ousted vaccine director rick bright says there appears to be no master coordinated plan on how the us is responding to coronavirus"
"285",2020-05-14,"ousted vaccine director dr rick bright says the us will endure darkest winter in modern history if it does not take extra preparations for coronavirus"
"286",2020-05-14,"congress hears testimony from exvaccine director dr rick bright who says he was fired for opposing the trump administration's covid response follow live updates"
"287",2020-05-14,"hong kong aims to test more than people living in two apartment buildings as a new local coronavirus cluster grows"
"288",2020-05-14,"new fbi seizes republican sen richard burr's phone in an investigation of stock trades after coronavirus briefings los angeles times reports"
"289",2020-05-13,"the iconic hollywood bowl amphitheater in la which hosts about concerts each summer will not open for the season due to the covid pandemic"
"290",2020-05-13,"more than people have died from coronavirus in france since the first of march follow live updates"
"291",2020-05-13,"more than people have died in the us from coronavirus follow live updates"
"292",2020-05-13,"former trump campaign chairman paul manafort is released from prison following a request by his lawyers due to the coronavirus pandemic he will serve the rest his prison term in home confinement"
"293",2020-05-12,"a key coronavirus model often cited by the white house has again raised its death projection now predicting deaths in the us by august"
"294",2020-05-12,"dr anthony fauci says the united states does not have total control yet of the coronavirus pandemic follow live updates"
"295",2020-05-12,"sen patty murray the top democrat on the health education labor and pensions committee says her colleagues must dig for the truth about coronavirus because trump is not follow live updates"
"296",2020-05-12,"five covid patients died in a st petersburg russia hospital in a fire apparently started by a malfunctioning ventilator state media reported"
"297",2020-05-12,"two gop senators chuck grassley and joni ernst who traveled with vp pence after it was discovered pence's press secretary has coronavirus say they haven't been tested for the virus and do not plan to get tested"
"298",2020-05-11,"the us coronavirus death toll passes the most reported deaths of any country in the world as most states move toward phased reopening"
"299",2020-05-11,"avianca the world's secondoldest airline files for bankruptcy because of the unforeseeable impact of the covid pandemic the airline says"
"300",2020-05-10,"the us chief of naval operations will selfquarantine after coming in contact with a family member who tested positive for the coronavirus an official says"
"301",2020-05-10,"vice president mike pence is not planning to enter selfquarantine after his press secretary tested positive for coronavirus last friday he plans to be at the white house on monday a pence spokesperson says"
"302",2020-05-10,"about of the state of ohio is set to open even after a recent uptick in new covid cases gov mike dewine says"
"303",2020-05-10,"johnson amp johnson aims to produce billion coronavirus vaccines by next year the company's chief scientific officer says"
"304",2020-05-10,"wuhan china reports its first new coronavirus case in more than a month"
"305",2020-05-10,"dr anthony fauci says he will begin a modified quarantine after he had lowrisk contact with a white house staffer who has coronavirus he will telework for weeks but might go into his office with no one else there"
"306",2020-05-09,"cdc director robert redfield will selfquarantine for two weeks after being exposed to someone at the white house who tested positive for covid a cdc spokesman confirmed"
"307",2020-05-09,"a sioux tribe has rejected an ultimatum by south dakota's governor to remove checkpoints on state highways within tribal reservations designed to prevent the spread of coronavirus"
"308",2020-05-09,"coronavirus has infected more than million people and killed more than worldwide a count from johns hopkins university says"
"309",2020-05-09,"roy horn who was half of the siegfried and roy magic and animal act until his injury has died from covid he was"
"310",2020-05-09,"the number of childhood vaccinations has plunged since the covid pandemic began spreading in the us the cdc says"
"311",2020-05-08,"president trump says the white house is in no rush to pass additional stimulus funds in response to coronavirus"
"312",2020-05-08,"trump confirms pence's press secretary katie miller tested positive for covid her husband is senior trump adviser stephen miller"
"313",2020-05-08,"a member of vice president pence's staff has tested positive for coronavirus two sources tell cnn follow live updates"
"314",2020-05-08,"a coalition of us public transportation agencies requests an additional billion in emergency federal aid to help address the coronavirus pandemic"
"315",2020-05-08,"coronavirus could kill as many as people in africa during the first year of the pandemic if containment measures fail the world health organization warns follow live updates"
"316",2020-05-07,"coronavirus is deadlier in the us than the seasonal flu a new study finds follow live updates"
"317",2020-05-07,"california's first case of coronavirus community spread started in a nail salon the governor says follow live updates"
"318",2020-05-07,"a texas salon owner who defied the state's order to close for coronavirus will be released from jail the supreme court of texas rules"
"319",2020-05-07,"one of president trump's personal valets has tested positive for coronavirus cnn has learned"
